{"$schema":"https://json-schema.org/draft/2020-12/schema","$id":"https://agensfield.dev/scriba/schemas/event.schema.json","title":"Scriba agent event","type":"object","additionalProperties":false,"required":["schemaVersion","id","providerId","accountId","kind","detectedAt","data"],"properties":{"schemaVersion":{"const":"scriba.event.v2"},"id":{"type":"string","minLength":1},"providerId":{"enum":["codex","claude"]},"accountId":{"type":"string","pattern":"^acct-[0-9a-f]{20}$"},"kind":{"enum":["remaining_checkpoint","reset_transition","grant_available","grant_expiry_checkpoint"]},"detectedAt":{"type":"string","format":"date-time"},"data":{}},"oneOf":[{"properties":{"kind":{"const":"remaining_checkpoint"},"data":{"$ref":"#/$defs/remainingCheckpoint"}}},{"properties":{"kind":{"const":"reset_transition"},"data":{"$ref":"#/$defs/resetTransition"}}},{"properties":{"kind":{"const":"grant_available"},"data":{"$ref":"#/$defs/grantAvailable"}}},{"properties":{"kind":{"const":"grant_expiry_checkpoint"},"data":{"$ref":"#/$defs/grantExpiryCheckpoint"}}}],"$defs":{"windowKey":{"enum":["primary.five_hour","primary.weekly","spark.five_hour","spark.weekly","review.five_hour","review.weekly","oauth_apps.weekly","sonnet.weekly","design.weekly","routines.weekly","extra.current"]},"remainingCheckpoint":{"type":"object","additionalProperties":false,"required":["windowKey","checkpointPercent","usedPercent","remainingPercentPoints"],"properties":{"windowKey":{"$ref":"#/$defs/windowKey"},"checkpointPercent":{"type":"number","minimum":0,"maximum":100},"usedPercent":{"type":"number","minimum":0,"maximum":100},"remainingPercentPoints":{"type":"number","minimum":0,"maximum":100},"resetAt":{"type":"string","format":"date-time"}}},"resetTransition":{"type":"object","additionalProperties":false,"required":["windowKey","resetKind","previousResetAt","resetAt"],"properties":{"windowKey":{"$ref":"#/$defs/windowKey"},"resetKind":{"enum":["scheduled","early"]},"previousResetAt":{"type":"string","format":"date-time"},"resetAt":{"type":"string","format":"date-time"}}},"grantAvailable":{"type":"object","additionalProperties":false,"required":["availableCount"],"properties":{"availableCount":{"type":"integer","minimum":0},"earliestExpiryAt":{"type":"string","format":"date-time"}}},"grantExpiryCheckpoint":{"type":"object","additionalProperties":false,"required":["checkpointDays","expiresAt"],"properties":{"checkpointDays":{"type":"integer","minimum":0},"expiresAt":{"type":"string","format":"date-time"}}}}}
